<?xml version="1.0" encoding="UTF-8"?>
<!DOCTYPE computer-store SYSTEM "computer_shop.dtd">

<computer-store>
    <parts>
        <processors>
            <processor id="I54200H" socket="A1" integrated_video="true">
                <model>i5 4200H</model>
                <manufacturer>Интел</manufacturer>
                <architecture>Максуел</architecture>
                <clock-frequency>2800</clock-frequency>
                <cache>
                    <levels>3</levels>
                    <memory>3МБ</memory>
                </cache>
                <threads>
                    <physical>2</physical>
                    <logical>4</logical>
                </threads>
                <available>6</available>
                <price>180 лева</price>
            </processor>
        </processors>
        
        <ram-boards>
            <ram-board id="K4" type="D1">
                <manufacturer>Kingston</manufacturer>
                <memory>4ГБ</memory>
                <frequency>1664 мега-херца</frequency>
                <channel>двоен</channel>
                <available>3</available>
                <price>80 лева</price>
            </ram-board>
        </ram-boards>
        
        
        <video-cards>
            <video-card id="GTX850" interface="PCIE-3">
                <manufacturer>NVidia</manufacturer>
                <model>GTX 850m</model>
                <gpu_memory type="GD5">2ГБ</gpu_memory>
                <bus-width>128 бита</bus-width>
                <bandwidth>28.8 ГБ/с</bandwidth>
                <directx>12</directx>
                <shaders>14.4 гига-пиксела/с</shaders>
                <available>3</available>
                <price>80 лева</price>
            </video-card>
        </video-cards>
        
        <hard-drives>
            <hard-drive id="H1" bus="SATA2" laptop-compatible="true">
                <manufacturer>Hitachi</manufacturer>
                <drive-memory>
                    <amount>1ТБ</amount>
                    <type>Флаш</type>
                </drive-memory>
                <speed>1800 оборота/м</speed>
                <size>2.5 инча</size>                
                <available>3</available>
                <price>80 лева</price>
            </hard-drive>
        </hard-drives>
        
        <motherboards>
            <motherboard id="M1"
                         socket-id="S1"
                         processor="I54200H"
                         video-card="GTX850"
                         ram-memory="K4"
                         hard-drive="H1">
                <manufacturer>Foxconn</manufacturer>
                <chipset>Haswell</chipset>
                <available>3</available>
                <price>80 лева</price>
            </motherboard>
        </motherboards>
    </parts>
    
    <sockets>
        <socket id="A1">AM3</socket>
        <socket id="S1">AM2+</socket>
    </sockets>
    <memory-types>
        <memory-type id="D1">DDR1</memory-type>
        <memory-type id="GD5">GDDR5</memory-type>
    </memory-types>
</computer-store>
